{
  "$schema": "https://json-schema.org/draft/2020-12/schema",
  "$id": "https://mastermind-x.com/contracts/specialist_packs/pack.pk04.v1.schema.json",
  "title": "Specialist pack PK04 v1 catalogue",
  "description": "Revenue recognition and contract balances. Result instances validate against specialist_pack_result.v1. The field catalogue is unspecified at contract v1; the pack implementation populates fields and checks and sets catalogue_state to specified.",
  "pack_schema_id": "pack.pk04/v1",
  "pack_id": "PK04",
  "name": "Revenue recognition and contract balances",
  "boundary": "Recognized revenue, deferrals and contract assets/liabilities distinguished; period-compatible movement.",
  "requires": [
    "schema",
    "source-qualified golden set",
    "independent domain review",
    "held-out quality test",
    "typed absences",
    "production source trace"
  ],
  "catalogue_state": "unspecified",
  "fields": [],
  "checks": [],
  "reason_codes": [],
  "type": "object",
  "additionalProperties": false
}
