{
  "$schema": "https://json-schema.org/draft/2020-12/schema",
  "$id": "https://mastermind-x.com/contracts/specialist_packs/pack.pk03.v1.schema.json",
  "title": "Specialist pack PK03 v1 catalogue",
  "description": "Segments and geographic/product dimensions. Result instances validate against specialist_pack_result.v1. The field catalogue is unspecified at contract v1; the pack implementation populates fields and checks and sets catalogue_state to specified.",
  "pack_schema_id": "pack.pk03/v1",
  "pack_id": "PK03",
  "name": "Segments and geographic/product dimensions",
  "boundary": "Dimensional maps, eliminations and reporting-definition changes; no theme or relationship graph.",
  "requires": [
    "schema",
    "source-qualified golden set",
    "independent domain review",
    "held-out quality test",
    "typed absences",
    "production source trace"
  ],
  "catalogue_state": "unspecified",
  "fields": [],
  "checks": [],
  "reason_codes": [],
  "type": "object",
  "additionalProperties": false
}
