{
  "$schema": "https://json-schema.org/draft/2020-12/schema",
  "$id": "https://mastermind-x.com/contracts/specialist_packs/pack.pk08.v1.schema.json",
  "title": "Specialist pack PK08 v1 catalogue",
  "description": "Legal contingencies. Result instances validate against specialist_pack_result.v1. The field catalogue is unspecified at contract v1; the pack implementation populates fields and checks and sets catalogue_state to specified.",
  "pack_schema_id": "pack.pk08/v1",
  "pack_id": "PK08",
  "name": "Legal contingencies",
  "boundary": "Allegations, disclosed ranges and procedural status separated; not probability of liability.",
  "requires": [
    "schema",
    "source-qualified golden set",
    "independent domain review",
    "held-out quality test",
    "typed absences",
    "production source trace"
  ],
  "catalogue_state": "unspecified",
  "fields": [],
  "checks": [],
  "reason_codes": [],
  "type": "object",
  "additionalProperties": false
}
